{
  "schema": "mycelink-bench/qualification@2",
  "project": "changesets",
  "prd": "CSET-203",
  "source_identity_sha256": "5286b96d7f7c3458cfd501928107e9ef0c136f708fb2c493d1a15fb9b80bda32",
  "evaluator_digest_sha256": "f939ef763fbb6fc3d9c9ac08489b8b95396ef6bdf53e1df01d0edcc9a1d1e5ed",
  "bindings": {
    "cache_lock_sha256": "aaa1dcdcf485d67f4eb4bc9e6a6ca73f7c2054870da173896655201cd764b350",
    "toolchains": {
      "node": "8c0043d1d6848ea3eccaf165697c3ded3f400e045f457870a89e0923b933faef"
    },
    "commands": {
      "full_suite_sha256": "86e52505affe317fc8fb59f0f455435264e7bd94e8aca748f7a895a2b9e89419",
      "hidden_sha256": "8aa68548cd307071d29f51e69eb22929e2157a3052128dacd64ac69ff0449c27"
    }
  },
  "hidden_tests": {
    "total": 15,
    "failing_at_baseline": 13,
    "passing_at_baseline": 2
  },
  "baseline_failure_categories": {
    "assertion": 13
  },
  "superseded_tests": 0,
  "reference": {
    "full_suite_tests": 818,
    "own_tests": 11,
    "tdd_units": [
      "valid"
    ],
    "new_tests_by_module": {
      "apply-release-plan": 4,
      "cli": 7
    }
  },
  "mutants": {
    "gating": 3,
    "killed": 3,
    "stress": [],
    "by_module": {
      "apply-release-plan": 2,
      "cli": 1
    }
  },
  "runs": 2,
  "tmp_roots": 1,
  "filesystems": {
    "distinct": 2,
    "roots": [
      {
        "role": "work",
        "type": "ext4"
      },
      {
        "role": "tmp-root-1",
        "type": "tmpfs"
      }
    ]
  },
  "duration_ms": 142525
}
