{
  "schema": "mycelink-bench/qualification@2",
  "project": "spring-petclinic-microservices",
  "prd": "PCM-102",
  "source_identity_sha256": "92ab8fe8fd6e365586f2a0821fd8a3461093e8d3cc3b1d217b11b32c6cc0f8f7",
  "evaluator_digest_sha256": "1ac40a2f766537f8ab7c7dbcb36ad26c3fc42653ebd0c0c4a40c72f029d324fa",
  "bindings": {
    "cache_lock_sha256": "aaa1dcdcf485d67f4eb4bc9e6a6ca73f7c2054870da173896655201cd764b350",
    "toolchains": {
      "java": "2ffa7198a574ef6109be06b23706b72e6a0a5436497c622d2b023d6348d2c024"
    },
    "commands": {
      "full_suite_sha256": "8bf546a5aced931896c49150a7493ca864a74109aa178198fc24c3145a8a0772",
      "hidden_sha256": "12e7581b7893378ccdc5747461a1e6420df63f75b84a83b01fbf2d2a40f46a65"
    }
  },
  "hidden_tests": {
    "total": 15,
    "failing_at_baseline": 8,
    "passing_at_baseline": 7
  },
  "baseline_failure_categories": {
    "assertion": 8
  },
  "superseded_tests": 0,
  "reference": {
    "full_suite_tests": 15,
    "own_tests": 9,
    "tdd_units": [
      "valid"
    ],
    "new_tests_by_module": {
      "customers-service": 5,
      "api-gateway": 4
    }
  },
  "mutants": {
    "gating": 3,
    "killed": 3,
    "stress": [],
    "by_module": {
      "customers-service": 1,
      "api-gateway": 2
    }
  },
  "runs": 2,
  "tmp_roots": 1,
  "filesystems": {
    "distinct": 2,
    "roots": [
      {
        "role": "work",
        "type": "ext4"
      },
      {
        "role": "tmp-root-1",
        "type": "tmpfs"
      }
    ]
  },
  "duration_ms": 262454
}
