{
  "schema": "mycelink-bench/qualification@2",
  "project": "spring-petclinic-microservices",
  "prd": "PCM-101",
  "source_identity_sha256": "92ab8fe8fd6e365586f2a0821fd8a3461093e8d3cc3b1d217b11b32c6cc0f8f7",
  "evaluator_digest_sha256": "7a136b73356816fb7b8b325da7cc6ea3aa1cb8253a9daab1eaa075f40583455a",
  "bindings": {
    "cache_lock_sha256": "aaa1dcdcf485d67f4eb4bc9e6a6ca73f7c2054870da173896655201cd764b350",
    "toolchains": {
      "java": "2ffa7198a574ef6109be06b23706b72e6a0a5436497c622d2b023d6348d2c024"
    },
    "commands": {
      "full_suite_sha256": "8bf546a5aced931896c49150a7493ca864a74109aa178198fc24c3145a8a0772",
      "hidden_sha256": "811b22545b5902b51213c124e1bc0cf24886f2a4f6065e596327f6cbed85af73"
    }
  },
  "hidden_tests": {
    "total": 19,
    "failing_at_baseline": 14,
    "passing_at_baseline": 5
  },
  "baseline_failure_categories": {
    "assertion": 14
  },
  "superseded_tests": 2,
  "reference": {
    "full_suite_tests": 15,
    "own_tests": 8,
    "tdd_units": [
      "valid"
    ],
    "new_tests_by_module": {
      "visits-service": 6,
      "api-gateway": 2
    }
  },
  "mutants": {
    "gating": 3,
    "killed": 3,
    "stress": [],
    "by_module": {
      "visits-service": 1,
      "api-gateway": 2
    }
  },
  "runs": 2,
  "tmp_roots": 1,
  "filesystems": {
    "distinct": 2,
    "roots": [
      {
        "role": "work",
        "type": "ext4"
      },
      {
        "role": "tmp-root-1",
        "type": "tmpfs"
      }
    ]
  },
  "duration_ms": 306987
}
